<?xml version="1.0" encoding="UTF-8"?>
<!DOCTYPE restaurants SYSTEM "restaurants.dtd">
<restaurants>
  <restaurant>
    <id>0</id>
    <name>Kabana</name>
    <cuisine>Indian</cuisine>
    <city>Berkeley</city>
    <open>12pm</open>
    <close>9pm</close>
  </restaurant>
  <restaurant>
    <id>1</id>
    <name>Cheeseboard</name>
    <cuisine>Italian</cuisine>
    <city>Berkeley</city>
    <open>11am</open>
    <close>8pm</close>
  </restaurant>
  <restaurant>
    <id>2</id>
    <name>The Butcher's Son</name>
    <cuisine>American</cuisine>
    <city>Berkeley</city>
    <open>9am</open>
    <close>3pm</close>
  </restaurant>
</restaurants>